Link,Title,Name,Location,Salary,Summary
https://kr.indeed.com/viewjob?jk=8cf4c963f2e04796,Platform Designer,SCOR,대한민국,,"value added and innovative products and services and making long- term commitments... clients, namely insurers and large..."
https://kr.indeed.com/viewjob?jk=4e6de9c6eee09a91,"Sr. Analyst, FP&A - Korea",Under Armour,서울,,assess financial return... business... mid-long term Ad-hoc duties/projects as assigned (eg. Review meeting...
https://kr.indeed.com/viewjob?jk=0475c02b54919194,Senior Solution Sales Executive-SAP ARIBA,SAP,서울,,"passionate about customer success, customer delight, and long- term customer relationships Outcome focused... role..."
https://kr.indeed.com/viewjob?jk=107ee085b67c5f7e,Lead Sales Representative,Stryker,서울,,"achieve financial goals... business. Develop short- term and long- term sales strategy, execute marketing plans through..."
https://kr.indeed.com/viewjob?jk=e3a9d68ac5310fe8,CIB Operations - Market Operations - Trade Processing Specia...,"JPMorgan Chase Bank, N.A.",서울,,"drives everything we do. We strive to build trusted, long- term partnerships to help our clients achieve... business..."
https://kr.indeed.com/viewjob?jk=c0bf23e425018d70,Vitality Business Development & Partnerships (Team Leader),AIA,서울,,Samsung Credit Card) and developing long term customer relationships that engages... Develop a short and long term financial...
https://kr.indeed.com/viewjob?jk=1a0ef6022492b481,Short-Term Teaching Positions with PAY,Chung Dahm Learning,대한민국,,English Native Level Location All Area Job Description Short- Term Teaching Positions with GREAT PAY! CHUNGDAHM LEARNING...
https://kr.indeed.com/viewjob?jk=7e43bab8bbc73adb,CS EUV Pyeongtaek Team Lead,에이에스엠엘코리아,경기도 평택,,roadmap.Drive technical requirements for short term and mid- term solutions. Creating harmonized team culture and continuous...
https://kr.indeed.com/viewjob?jk=904b3d9f521abc46,Clinical Research Manager,MSD,서울,,"local and regional strategy development consistent with long‐ term corporate needs in conjunction with CRD, TAH and Regional..."
https://kr.indeed.com/viewjob?jk=66f33eab9c93bd89,Sales and Customer Management Executive,British Council,서울,,"longer term, creating benefit... publications. Contract: One year fixed term (renewable) | Location: Seoul – Seocho..."
https://kr.indeed.com/viewjob?jk=ddea19516f3946cc,"Snr Specialist II, Talent Acquisition",ASM,경기도 화성,,"exceptional diverse talent for open roles (permanent, fixed term contracts, internships etc.) within the organisation. Build..."
https://kr.indeed.com/viewjob?jk=2b1f57fb635f126f,[Van Cleef & Arpels] Client Engagement Manager,Van Cleef & Arpels,서울,,support the BTQ’s to leverage tools to build loyalty and long term relationships with clients. Reporting to Local Client...
https://kr.indeed.com/viewjob?jk=cfa06cfec5677ee0,Finance Business Partner manager 채용,한국아스텔라스제약,서울 청담동,,"cycles... annual budget, interim forecasts and overall mid- term plan (MTP). - Prepare and analyse P&L at market..."
https://kr.indeed.com/viewjob?jk=16212c98f49f0245,New Business Manager (Hunter),PLATTS,서울,,e.g. S&P Global Platts Net Promoter Score) over the long term.” Requirements: Degree with minimum 3-5 years of successful...
https://kr.indeed.com/viewjob?jk=0c7820d3d36e5498,CADD팀 (팀원) - IT신기술 기반 신약개발 신약개발 전문기업,,서울특별시,,"지원 2) GPCR, non-GPCR pipeline 매니저 cross communication 3) Long Term Project : ( 협의 후 결정 ) 4) 교육 훈련 참가 : ( 협의 후 결정 ) 5) 기타 Role..."
https://kr.indeed.com/viewjob?jk=06bee2f6c878e456,"Strategic Account Manager, Korea",Illumina,서울,,"value, long- term profitable customer accounts through relationship building sales techniques. Develop short and long- term key..."
https://kr.indeed.com/viewjob?jk=cb34db7452b833ef,Manager in Asset management 글로벌 쇼핑몰 개발운영 기업,,서울특별시,,"data about monthly tenant’s gross sales, revenue, expense, lease term. (월간 테넌트 총 매출, 수입, 지출 보고서, 임대 계약 정보, 등 쇼핑센터 실적 관련 정보수집..."
https://kr.indeed.com/viewjob?jk=6a77c2edad1d4160,Translator Intern,RWS,서울,,associated... use... resume... considered null and void. Category Translation Job Type Fixed Term Contract
https://kr.indeed.com/viewjob?jk=5dc36fbdd42e5917,글로벌 EC그룹 E-Commerce 매니저 채용,Success Korea,서울 청담동,,business plans that result... establishment of a long term interactive... consumer ? Develop a plan and Lead global...
https://kr.indeed.com/viewjob?jk=adfd945c59fd55e1,Key Account Manager,Danfoss,서울,,key accounts focusing on Samsung and Hyundai by building long term strategic relationship Collaborate with business segments...
https://kr.indeed.com/viewjob?jk=60cff7829a363f04,Senior Brand Manager – FIFA Online 4,Electronic Arts,서울,,ensuring all teams are driving together towards a singular long- term vision. Regional brand approvals and oversight of brand...
https://kr.indeed.com/viewjob?jk=4073954921a2a81d,마케팅 매니저,Success Korea,서울,,order to achieve the business objectives and long- term growth. - Aimed in meeting the higher customers satisfaction...
https://kr.indeed.com/viewjob?jk=95600ecf79c6f2b1,"CIB - Corporate Sales Analyst, Seoul - Korea","JPMorgan Chase Bank, N.A.",서울,,"drives everything we do. We strive to build trusted, long- term partnerships to help our clients achieve... business..."
https://kr.indeed.com/viewjob?jk=077c3571009bdf1c,Services Engagement Manager,Veeva Systems,경기도,,need and set expectations correctly... focus on long- term success Deliver Proposals and Statements of Work (SOW) along...
https://kr.indeed.com/viewjob?jk=e901434c55055e6a,Customer Quality Manager,Dupont,경기도 화성,,roadmaps will include the short-mid term CIP efforts to continually drive improved... well as long term actions to help win new...
https://kr.indeed.com/viewjob?jk=0bdb1e197ba29dd4,Flight Inspector 4 - Republic of Korea,Northrop Grumman UK,대한민국,,"President or Director positions may be eligible for Long Term Incentives. In addition, Northrop Grumman provides a variety..."
https://kr.indeed.com/viewjob?jk=f73e40a47cc756e7,Major Account Manager,Trend Micro,서울,,"levels ( CXOs , Managers , Specialists) to establish a long term professional trust-based relationship that enables Trend..."
https://kr.indeed.com/viewjob?jk=,,Hexagon PPM,서울,,consequences of new ideas or concepts and anticipates long term opportunities and requirements formulating plans to meet them...
https://kr.indeed.com/viewjob?jk=,,Dassault Systèmes,서울,,Brand discipline to gain customer commitment on long- term business transformation. You have dreams? You enjoy a challenge...
https://kr.indeed.com/viewjob?jk=,,Vestas,서울,,"thereby contributing towards the long term growth... organisation, possessing... Experience with long- term sales processes..."
https://kr.indeed.com/viewjob?jk=,,Amazon Web Services Korea LLC,서울,,revenue while working on big-rocks... lead to long- term sustained growth • Build cross-industry and cross-service...
https://kr.indeed.com/viewjob?jk=,,Siemens,경기도 성남,,build and improve customer relationships to ensure long term customer satisfaction and become the go-to expert for all...
https://kr.indeed.com/viewjob?jk=,,Boehringer Ingelheim,대한민국,,"family-owned ever since, Boehringer Ingelheim takes a long- term perspective. Now, we are powered by 52,000 employees..."
https://kr.indeed.com/viewjob?jk=,,FARO Technologies,부산광역시,,leads and close sales to achieve revenue goals and create long- term purchase agreements with key accounts. Generate sales...
https://kr.indeed.com/viewjob?jk=,,New Relic,서울,,sales account executives with focus on bringing long term value... company Existing network of strategic enterprise...
https://kr.indeed.com/viewjob?jk=,,Trend Micro,서울,,"levels ( CXOs , Managers , Specialists) to establish a long term professional trust-based relationship that enables Trend..."
https://kr.indeed.com/viewjob?jk=,,Bacardi,서울,,"support... effective Decision making Short and long term financial projections Prepare budget, latest estimate and ensure..."
https://kr.indeed.com/viewjob?jk=,,Amazon Web Services Korea LLC,서울,,appropriate strategic investments while maintaining the short- term delivery of leads; metrics/ROI focused and knows how...
https://kr.indeed.com/viewjob?jk=,,Henkel,서울 강남구,,"JOB ID: 21026918 Contract & Job type: Full Time, Limited Term Contact information for application-related questions..."
https://kr.indeed.com/viewjob?jk=,,머크,서울 강남구,,establishment of training priorities for both long term and short- term objectives Monitors and reports on progress...
https://kr.indeed.com/viewjob?jk=,,Micro Focus,서울,,bottoms up sales through teams Responsibilities: Develops long term sales pipeline to increase the company's market share...
https://kr.indeed.com/viewjob?jk=,,틱톡,서울 강남구,,"organizations and influencer groups, working to drive long- term adoption and set growth strategies for our partners. Ideal..."
https://kr.indeed.com/viewjob?jk=,,TikTok,서울,,other technology-relevant public policy concerns. 3. Building long- term strategic relationships with local partners; develop...
https://kr.indeed.com/viewjob?jk=,,tesa,서울,,"chain execute short-, mid- and long- term strategies for assigned markets, customers... mid- and long- term strategic planning..."
https://kr.indeed.com/viewjob?jk=,,JW그룹,서울 서초동,,"신제품 후보물질 발굴 및 License-in 추진 - 신규물질 스크리닝, 제품검토 및 시장성 평가, 사업제안, Term sheet협의 2. 신약개발과제 License-out 관련 업무의 기획 및 추진 - 내부 개발현황 파악..."
https://kr.indeed.com/viewjob?jk=,,DNV,서울,,comprises the delivery of Measurement Services and long- term energy forecasts to support due diligence of wind and solar...
https://kr.indeed.com/viewjob?jk=,,AstraZeneca,서울,,"undertaken... company, as well... medium to long- term strategy and decision making. Provide support in assisting..."
https://kr.indeed.com/viewjob?jk=,,Burberry,서울,,"mindset is core to our business and key to our long- term success. JOB PURPOSE Service excellence ambassador, responsible..."
https://kr.indeed.com/viewjob?jk=,,Dassault Systèmes,서울,,Industry Fundamentals to get customer commitment on a long- term business transformation Leverage 3DEXPERIENCE Platform as our...
https://kr.indeed.com/viewjob?jk=,,Synopsys,경기도 성남,,6. The role is also required systemic thinking... long term talent strategy to accumulate pipeline for local critical...
https://kr.indeed.com/viewjob?jk=,,CBRE,서울,,"materials necessary for transactions - Prepares offers, term sheets and lease amendments... responsible for project..."
https://kr.indeed.com/viewjob?jk=,,DataDog,서울,,continues to innovate... well positioned... long term... Team: Our sales team works... best-of-breed product...
https://kr.indeed.com/viewjob?jk=,,Red Bull,서울,,"brand by designing and executing a short-, mid- and long- term Sports/E-Sports & Culture program achieving strong credibility..."
https://kr.indeed.com/viewjob?jk=,,Medtronic,서울,,operators and referrers Good ability to set up long- term marketing and business strategies including revenue/operational...
https://kr.indeed.com/viewjob?jk=,,Twitch Korea LLC,서울 강남구,,"clients, agencies, and media reps. · Develop and manage long- term strategic relationships with clients and agencies. · Create..."
https://kr.indeed.com/viewjob?jk=,,H.B. Fuller,서울,,"market trends, uncovering unmet needs, building short & long term business plans... leading the execution... business..."
https://kr.indeed.com/viewjob?jk=,,,서울특별시,,"data about monthly tenant’s gross sales, revenue, expense, lease term. (월간 테넌트 총 매출, 수입, 지출 보고서, 임대 계약 정보, 등 쇼핑센터 실적 관련 정보수집..."
https://kr.indeed.com/viewjob?jk=,,Electrolux,대한민국,,"them. ü Develop, build & maintain strong and long term relationship with digital customers ü Close communication to deliver..."
https://kr.indeed.com/viewjob?jk=,,Red Hat Software,서울,,programs and commercial buying programs to build long- term strategic relationships with customers Produce referenceable...
https://kr.indeed.com/viewjob?jk=,,Shopee,서울,,projects Lead some issue management and develop short term and long term solution Efficiently organize and convene meetings...
https://kr.indeed.com/viewjob?jk=,,Google,서울,,customers attain... business goals while building long- term capabilities. Behind every advertising campaign at Google...
https://kr.indeed.com/viewjob?jk=,,Ecolab,서울,,"set of cleaning and sanitation solutions Carve out a long term, advanced career path in sales/service, corporate accounts..."
https://kr.indeed.com/viewjob?jk=,,BALENCIAGA KOREA LTD,부산광역시,,역량을 펼칠 수 있는 기회를 함께 모색하고자 합니다. Job Type Fixed Term (Fixed Term) Start Date 2021-03-04 Schedule Full time Organization...
https://kr.indeed.com/viewjob?jk=,,Asiance,서울,,품권 지급 Working from home Leaving work at 4 o'clock on Long- term employee Chuseok & every Wednesday (Flexible) the last Friday...
https://kr.indeed.com/viewjob?jk=,,Dupont,경기도 화성,,roadmaps will include the short-mid term CIP efforts to continually drive improved... well as long term actions to help win new...
https://kr.indeed.com/viewjob?jk=,,Genesys,서울,,"Assists... development of short, medium, and long- term plans to achieve strategic objectives Regularly interacts across..."
https://kr.indeed.com/viewjob?jk=,,Macquarie Group Limited,서울,,"strategy. Execution of transactions will include initial term sheet negotiations, managing due diligence, negotiation..."
https://kr.indeed.com/viewjob?jk=,,ASM,경기도 화성,,internal and external stakeholders. Understand and build long- term innovative global technology systems that enable enhanced...
https://kr.indeed.com/viewjob?jk=,,CBRE,서울,,client premises in Yeoido Contract Type: Regular (open term) JOB SUMMARY Provides administrative support to a department...
https://kr.indeed.com/viewjob?jk=,,"JPMorgan Chase Bank, N.A.",서울,,"do. We strive to build trusted, long- term partnerships to help our clients achieve... cultivate long term partnership with key..."
https://kr.indeed.com/viewjob?jk=,,Dupont,경기도 화성,,annual and long- term operating budgets... empowerment. Conducts annual and long- term succession planning. Critical Skills...
https://kr.indeed.com/viewjob?jk=,,"JPMorgan Chase Bank, N.A.",서울,,"drives everything we do. We strive to build trusted, long- term partnerships to help our clients achieve... business..."
https://kr.indeed.com/viewjob?jk=,,Nearthlab,서울 역삼역,,Identify new clients and partners and build positive and long- term relationships • Closely work with clients and partners...
https://kr.indeed.com/viewjob?jk=,,MOLOCO,서울 강남구,,6-Months Fixed- Term Customer Success... approach... focus on building long- term partnerships. Passions for continuous...
https://kr.indeed.com/viewjob?jk=,,Chloé,서울,,looking vision of femininity continues to inspire our long- term commitment to support the advancement of women. Women moving...
https://kr.indeed.com/viewjob?jk=,,Asiance,서울,,품권 지급 Working from home Leaving work at 4 o'clock on Long- term employee Chuseok & every Wednesday (Flexible) the last Friday...
https://kr.indeed.com/viewjob?jk=,,Adidas,서울,,Fully lead a customer`s annual sales plan and set a mid- term plan to grow both companies business... right strategy...
https://kr.indeed.com/viewjob?jk=b73ba4f97db9c888,Publisher Partnerships Manager,Criteo,서울,,diverse internal cross-functional teams Long/short term business strategy with insights from measurable data Who you...
https://kr.indeed.com/viewjob?jk=052f62d0acf5812a,A2R & Tax Accountant (KR Retained),Sanofi,서울,,"listening, Confidentiality Other • 12 months fixed- term contract • Black line to A2R KR Head based in Seoul • Position..."
https://kr.indeed.com/viewjob?jk=087c9b12a99ef520,CW-Associate Human Resources – Talent Acquisition,Amgen,서울,,"talent. Exercise a wide degree of creativity, near- and long- term recruiting vision, business understanding, and personal..."
https://kr.indeed.com/viewjob?jk=d537758b509eb82d,Associate C&B Specialist,MSD,서울,,calls or emails. Employee Status: Temporary (Fixed Term) Relocation: Domestic VISA Sponsorship: Travel Requirements...
https://kr.indeed.com/viewjob?jk=581f0773d0deb0c3,Logistics Analyst,CACI,대한민국,,Start: TS/SCI with Polygraph Employee Type: Regular-Long Term Assignment Percentage of Travel Required: Up to 10% Type...
https://kr.indeed.com/viewjob?jk=f03efe25b78605e9,"[Air Liquide Korea] H2E Business Developer, Upstream",에어리퀴드코리아,서울 강남구,,customer drivers and assist in building short/medium/long- term strategies. Missions and Responsibilities 마케팅·광고·홍보·조사>마케팅>마케...
https://kr.indeed.com/viewjob?jk=76aca9d890987d3a,"Public Sector Account Executive, Healthcare/Research",Amazon Web Services Korea LLC,서울,,prospects in order to build long- term business opportunity. You’ll also work... Develop long- term strategic partnerships...
https://kr.indeed.com/viewjob?jk=d40942770f615897,ENOVIA SALES EXPERT,Dassault Systèmes,서울,,Industry Fundamentals to get customer commitment on a long- term business transformation Leverage 3DEXPERIENCE Platform as our...
https://kr.indeed.com/viewjob?jk=dca6041ac243d216,Laundry & Home Care R&D Intern One year,Henkel,서울 강남구,,"JOB ID: 21026918 Contract & Job type: Full Time, Limited Term Contact information for application-related questions..."
https://kr.indeed.com/viewjob?jk=f473f4ab0c815719,영업관리 경력 정규직,스카우트파트너스,서울 강남구,,targets.- Responsible for delivery customer plan and long term & short term sales strategy to contribute stable sales growth...
https://kr.indeed.com/viewjob?jk=87d0b10c28fd5289,"CIB - Global Corporate Bank - Local Corporate - Analyst, Kor...","JPMorgan Chase Bank, N.A.",서울,,"drives everything we do. We strive to build trusted, long- term partnerships to help our clients achieve... business..."
https://kr.indeed.com/viewjob?jk=3a14bd392db8df1a,"Technical Account Mgr - Comms, Electronics and Semiconductor",MathWorks,서울,,projects... unique workflows Build and maintain long term relationships with customer decision makers and end users...
https://kr.indeed.com/viewjob?jk=7fb69385a101cc05,HR Specialist,HILTI,서울,,Forecast(RF)) W/H tax support We are proud to have a long- term bonding with our employees: More than 30% of our employees...
https://kr.indeed.com/viewjob?jk=5ad2ea0313301e31,New Business Developer,Glass Substrates for TFT-LCDs,대한민국,,development of technology and capabilities to support the long term needs... business -Collaborate... business unit...
https://kr.indeed.com/viewjob?jk=1fe5d621f35822dd,Managing Director - Country Manager Korea,BayWa r.e.,서울,,"projection. You... required to negotiate complex, long- term contracts... get Group buy... business context..."
https://kr.indeed.com/viewjob?jk=a3970146052a0006,Laundry & Home Care Marketing Graduate Development Program O...,Henkel,서울 강남구,,"JOB ID: 22027206 Contract & Job type: Full Time, Limited Term Contact information for application-related questions..."
https://kr.indeed.com/viewjob?jk=5113ba7fb4339b6e,Supplier Manager,Intel,대한민국,,strategies based on business market intelligence long- term analysis... commodity... supply ecosystem. Acquires...
https://kr.indeed.com/viewjob?jk=825ba5ca1ee72e32,Korea - JD Sports Account Lead Manager,Nike,서울,,"implementation of seasonal, annual, and long- term plans by closely collaborating with partners... applying an..."
https://kr.indeed.com/viewjob?jk=4bdec98863a23a36,Commercial Project Manager,Siemens Gamesa Renewable Energy,서울,,implementation of Long- Term Operation... than 5 years working experience in long term project management including budgeting...
https://kr.indeed.com/viewjob?jk=a106e743addfaf7f,Cluster Lead - Finance & Operations,Roche,서울,,organization Long- term portfolio... business in meeting short to long- term goals by providing relevant financial...
https://kr.indeed.com/viewjob?jk=9122ea33e8a854ab,Account Manager Fashion Korea,Lectra,서울,,new prospects * Develop and manage long term customer relationship and strengthen... long and short term Job Type: Full-time
https://kr.indeed.com/viewjob?jk=506b6e34ac5baca4,"Associative Focal Point (2 years, replacement)",국경없는의사회 한국,서울 강남구,,mail: recruit@seoul.msf.org 설명... position is a fixed- term contract for 2 years. <DESCRIPTION... ASSOCIATION> An...
https://kr.indeed.com/viewjob?jk=3afa74de0f0e2334,Customer Service Coordinator,AESOP Corporate,서울,,daily Aesop.com online order processing in Hybris in term of inventory availability and order tracking update Assist...
https://kr.indeed.com/viewjob?jk=093a4542f226400f,KAM,Galderma,서울,,roadmap realization with customers Develop sustainable and long term relationship with key accounts Have responsibility...
https://kr.indeed.com/viewjob?jk=850f439c1bbccc25,"Marketing Manager, Prescription",Galderma,서울,,Develop prescription BU budget and spending in a short- term and long- term Coordinate marketing strategy and tactical plan...
https://kr.indeed.com/viewjob?jk=34b2528afa386a17,"Senior AI/ML Consultant, Professional Services",Amazon Web Services Korea LLC,서울,,"doing analysis, discovering root causes, and designing long- term solutions... person who likes to have fun, loves..."
https://kr.indeed.com/viewjob?jk=de0d21966a3ee254,"Field Sales Representative, Enterprise, Google Cloud Custome...",Google,서울,,"relationships with enterprise customers. Influence long- term strategic direction, and serve as a business partner. Negotiate..."
https://kr.indeed.com/viewjob?jk=6901c46084cc9743,"Country Director, Enterprise Sales (Korea)",New Relic,서울,,sales account executives with focus on bringing long term value... company Existing network of strategic enterprise...
https://kr.indeed.com/viewjob?jk=691284637f5be09c,CATIA Sales Expert,Dassault Systèmes,서울,,Brand discipline to gain customer commitment on long- term business transformation. You have dreams? You enjoy a challenge...
https://kr.indeed.com/viewjob?jk=6d4a967f26e75120,Production Manager,FUCHS LUBRICANTS (KOREA) LTD.,울산,,Responsible... day-to-day operations and long term planning/management for manufacturing func-tions including production...
https://kr.indeed.com/viewjob?jk=1da9496668c86a23,Sr Staff (Sales) Account Mgr,Renesas Electronics Corporation,서울 강남구,,managing Data of Annual Revenue Plan /long- Term-Revenue Forecast/Quarterly Business... Revenue Plan /long- term-Revenue Forecast...
https://kr.indeed.com/viewjob?jk=289d0c638db25da1,Korea EHS Manager,Cytiva,서울,,so you can grow your career and expand your skills... long term. Cytiva is proud to work alongside a community of nine...
https://kr.indeed.com/viewjob?jk=69f416f783e702df,CIB - Sales & Marketing - Investor Access - 1 Year Fixed Ter...,"JPMorgan Chase Bank, N.A.",서울,,"drives everything we do. We strive to build trusted, long- term partnerships to help our clients achieve... business..."
https://kr.indeed.com/viewjob?jk=061fa2d91e9de253,Junior Key Account Manager,Energizer,서울,,relations with key customers or vendors to ensure long term partnership that promotes sales growth. Analyze sales relevant...
https://kr.indeed.com/viewjob?jk=b408fd8cebfdb47d,"Manager, Procurement (1Year)",Adidas,서울,,PR amount and guide the further procedures. Finalization of long- term contracts to ensure optimum costs and reliable supply...
https://kr.indeed.com/viewjob?jk=2c7ab1fd4063c976,Regional Director Field Service – Asia Pacific Region,Bloom Energy,서울,,region • Extensive knowledge of drivers of short and long term service cost and experience in national and international...
https://kr.indeed.com/viewjob?jk=7cb50b7187152bc1,Project Development Manager – South Korea,Lightsource Renewable Energy,서울,,model user-level skills required Ability to forge long term professional relationships with third parties Qualifications...
https://kr.indeed.com/viewjob?jk=525586bab74f441e,Clinical Project Assistant (1-year fixed term),Abbvie,서울,,About AbbVie AbbVie’s mission... discover and deliver innovative medicines that solve serious health issues today...
https://kr.indeed.com/viewjob?jk=f4575fd8d13aec0f,Store Manager,Versace,대구,,maintain a long term relationship... skills and ability to maintain long- term with clients and community and understands...
https://kr.indeed.com/viewjob?jk=add4dbdea57f6d81,"Manager II, Geographic Sales",H.B. Fuller,서울,,"market trends, uncovering unmet needs, building short & long term business plans... leading the execution... business..."
https://kr.indeed.com/viewjob?jk=5cfab6ad4d8165ff,Sr. Open Innovation Manager Battery Materials South Korea,Umicore,서울,,Incubation In NBI we develop long- term business opportunities... business... key long term technology partners...
https://kr.indeed.com/viewjob?jk=ad901a97a854b2c6,Sales Manager in Electronics,tesa,서울,,"chain execute short-, mid- and long- term strategies for assigned markets, customers... mid- and long- term strategic planning..."
