Link,Title,Name,Location,Salary,Summary
https://kr.indeed.com/viewjob?jk=e4efb05bff0fdb31,"Business Development specialist , Interventional Oncology",Success Korea,서울 강남구,,industry trends... impact on franchise short- term and long- term business plans to improve marketing and sales...
https://kr.indeed.com/viewjob?jk=b56c0b727af03d18,Luxury Brand Global eCommerce,Success Korea,서울 강남구,,business plans that result... establishment of a long term interactive... consumer ?Develop a plan and Lead global...
https://kr.indeed.com/viewjob?jk=19cb085ab3848dc8,Account Manager,FARO Technologies,부산광역시,,leads and close sales to achieve revenue goals and create long- term purchase agreements with key accounts. Generate sales...
https://kr.indeed.com/viewjob?jk=e3563f6660e48e70,Director of Digital Product Portfolio Management and Marketi...,Intuitive,서울,,actively invest in our team members to support... long- term growth so they can continue to advance our mission and achieve...
https://kr.indeed.com/viewjob?jk=cbf6a8872566d3b8,"Sr. Manager, Government Relations & Communications",Thermo Fisher Scientific,서울,,Leadership Team on business development opportunities and long- term business strategies including new investment locations...
https://kr.indeed.com/viewjob?jk=3d94b074d67ede19,RA팀 및 개발기획팀 경력직 채용,유영제약,진천 광혜원면,,"수익성분석 - In-license / Out-liecnse 검토 및 Business proposal 작성 Term sheet 및 계약서 협의, 체결 등 [필수] - 경력 : 5년 이상 - 학력 : 대학교졸(학사) 이상..."
https://kr.indeed.com/viewjob?jk=6726b0333e90153f,[SPS] Sales Representative,Honeywell,서울,,penetration and cross selling. Developing sustainable long- term relationships. Lead and Manage big scale of project from...
https://kr.indeed.com/viewjob?jk=e2372b6026274042,실시간 온라인과외앱 스냅애스크 Customer Success Manager,유한회사 스냅애스크,서울 강남구,,development and performance- Establish and maintain long term rapport with students and parents- Handle business operations...
https://kr.indeed.com/viewjob?jk=20b4aa8e4bc322bb,[Air Liquide Solutions Korea] Warehouse Technician (Cheonan),에어리퀴드코리아,천안 동남구,,consistent performances and responsibility over the long term. Entity and activity description Air Liquide Solutions Korea...
https://kr.indeed.com/viewjob?jk=cdd330db093abf5a,Account Manager,NETSCOUT,대한민국,,Korea Ability to learn new solution products in a short term period Experiences of sales to large customers in Korea Direct...
https://kr.indeed.com/viewjob?jk=8c319c77b1e1cbca,Adhesive Product Development Intern Busan,Henkel,부산광역시,,"Office JOB ID: 21026362 Contract & Job type: Full Time, Limited Term Contact information for application-related questions..."
https://kr.indeed.com/viewjob?jk=dbbadcf452b1d11e,"Sr Account Manager, Digital Native Business - Amazon Web Ser...",Amazon Web Services Korea LLC,서울,,"business... environment, and managing a team to build long- term business and marketing opportunities... ideal..."
https://kr.indeed.com/viewjob?jk=29ec70525e309417,글로벌 E-Commerce 팀장 채용,Success Korea,서울 강남구,,business plans that result... establishment of a long term interactive... consumer - Develop a plan and Lead global...
https://kr.indeed.com/viewjob?jk=db6a445c48409b46,KR_AH_CA Marketing Specialist (Temp.),Boehringer Ingelheim,대한민국,,"family-owned ever since, Boehringer Ingelheim takes a long- term perspective. Now, we are powered by 52,000 employees..."
https://kr.indeed.com/viewjob?jk=e304a4395da93b3d,Sales & Marketing Director 총괄,에이치알 코리아,서울,,"sales & marketing... achievement of short and long term business objectives, increased profit, and market share through..."
https://kr.indeed.com/viewjob?jk=09a4579303487462,Head of Commercial Marketing (Research Solutions),Merck KGaA Darmstadt Germany,서울,,implement digital culture to organization Driving long term growth strategy of business Build up the performingorganization...
https://kr.indeed.com/viewjob?jk=9420f2486873805d,SCM Cost Analyst,Edwards Korea Ltd,충청남도 천안,,management. Support the short term and long term business plans on overheads... short term and long term forecasting...
https://kr.indeed.com/viewjob?jk=63f54d3bc0f38cd0,National Key Account Manager - Pharma & Healthcare,Kuehne+Nagel,서울,,"effective, long- term solutions for our... best to take you on board... long term. Together, we will #winthefuture From..."
https://kr.indeed.com/viewjob?jk=764a0dcd283bdbd3,Master HVAC Technician - TS/SCI - South Korea,CACI,대한민국,,Required to Start: TS/SCI Employee Type: Regular-Long Term Assignment Percentage of Travel Required: Up to 25% Type...
https://kr.indeed.com/viewjob?jk=c0bcbe6881f18d43,Offshore Wind Power Turbine Specialist,Mott MacDonald,서울,,"either Japan, South Korea or Taiwan delivering long- term sustainable solutions. Join our team of specialists supporting..."
https://kr.indeed.com/viewjob?jk=62d06ad412041189,E-Commerce Assistant Key Account Manager,Electrolux,대한민국,,"them. ü Develop, build & maintain strong and long term relationship with digital customers ü Close communication to deliver..."
https://kr.indeed.com/viewjob?jk=1d248f9fb8119ebc,외국계 IT 기업 - AE (Account Executive),Success Korea,서울 강남구,,line knowledge. - Ability to develop long- term strategic and executive level... develop long- term strategic and executive...
https://kr.indeed.com/viewjob?jk=ed75832e441ec27d,Snr Technical Support Engineer,ASM,경기도 화성,,internal and external stakeholders. Understand and build long- term innovative global technology systems that enable enhanced...
https://kr.indeed.com/viewjob?jk=3fa8b25ba7f0784e,Offshore International Business Developer,HILTI,부산광역시,,skills. 2. Long- term strategic thinking... tools. We are proud to have a long- term bonding with our employees: More than 30...
https://kr.indeed.com/viewjob?jk=ceea9006a76afc25,Public Sector Business Development Executive,Success Korea,서울,,negotiations and liaison... legal group. - Develop long- term strategic partnerships in support of our key markets...
https://kr.indeed.com/viewjob?jk=8b3e29f47525032a,외국계헤어사업부PR,Success Korea,서울 강남구,,담당직무 글로벌코스메틱 헤어사업부 PR /커뮤니케이션- JD참조 Develop short- term/ long- term communication strategy and execute strategic PR campaigns...
https://kr.indeed.com/viewjob?jk=dd501a6ecef73d64,"Sales Representative (fixed-term), Channel Management",Thermo Fisher Scientific,서울,,"Title: Sales Representative, Channel Management Division: Chromatography & Mass Spectrometry Division (CMD) Location: Suseo..."
https://kr.indeed.com/viewjob?jk=61de6dbd5c9ede1a,KR_HP_Associate Medical Affairs Lead (Jardiance),Boehringer Ingelheim,대한민국,,"family-owned ever since, Boehringer Ingelheim takes a long- term perspective. Now, we are powered by 52,000 employees..."
https://kr.indeed.com/viewjob?jk=2040eba0c0f8262b,Account Manager,Ecolab,대한민국,,"structure and benefits A company vehicle and cell phone A long term, advancing career path in service, sales or management..."
https://kr.indeed.com/viewjob?jk=409534138c601bac,"Director, Campaign Planning, HBO Max",WarnerMedia,서울,,Europe and Global Brand and Marketing teams... Daily Long- Term Planning - you will identify the titles... grow our...
https://kr.indeed.com/viewjob?jk=c3bec88a0583d61f,E-Commerce Manager,Success Korea,서울 강남구,,소비재사 업무내용/자격요건 담당직무 E-Commerce Strategy - Develop mid to long- term corporate e-business and relationshipmarketing strategies...
https://kr.indeed.com/viewjob?jk=0eb8b5f23123ddf8,"Digital Content Specialist, Chromatography & Mass Spec.",Thermo Fisher Scientific,서울,,"requires someone who is proactive, thinks big and long- term, can exercise good judgment and communication and establish..."
https://kr.indeed.com/viewjob?jk=57980f7cc98ae3e2,Intern - Environment Affairs (171196),United Nations ESCAP,인천,,commission of any... acts. The term “sexual exploitation” means any actual... conditions. The term “sexual harassment...
https://kr.indeed.com/viewjob?jk=4ce55e56ddf87071,Robotic Drive Architect/Solution Architect,Luxoft,경기도 성남,,algorithms for PB scale data processing Defining long term technology roadmap and governing functional and non-functional...
https://kr.indeed.com/viewjob?jk=ed0db31c4330cb27,Site Success Manager,Veeva Systems,경기도,,SiteVault Free provides... organization Support the long- term success of more complex sites... work to implement...
https://kr.indeed.com/viewjob?jk=511a1021642b76b0,KR_HP_Head of Medical Affairs,Boehringer Ingelheim,대한민국,,"family-owned ever since, Boehringer Ingelheim takes a long- term perspective. Now, we are powered by 52,000 employees..."
https://kr.indeed.com/viewjob?jk=3d0c13d384c9507c,Head Of Product Marketing Manager,Success Korea,서울,,total VC -P&L responsibility... VC category -Mid/long term product portfolio development/management. -Work closely...
https://kr.indeed.com/viewjob?jk=607d391c7b46ebd1,Key Account Manager,Cytiva,서울,,so you can grow your career and expand your skills... long term. Cytiva is proud to work alongside a community of nine...
https://kr.indeed.com/viewjob?jk=d72538424072ea83,International Elementary Instructor (Grades K-1),IvyCollegiateSchool,인천,,fit is right. We prefer candidates... fit... long term as well. About the Position... working hours... five...
https://kr.indeed.com/viewjob?jk=cd88640fe6b6a7ec,Offshore Wind Power Structural Engineer,Mott MacDonald,서울,,"either Japan, South Korea or Taiwan delivering long- term sustainable solutions. Join a team of specialists supporting..."
https://kr.indeed.com/viewjob?jk=8db58de9cc5aab57,Business Leader - APAC Vault R&D and Quality,Veeva Systems,경기도,,execution Persistent the value and culture of Veeva for long- term customer success Requirements Excellent competency...
https://kr.indeed.com/viewjob?jk=e768fc6ba1e62be1,Enterprise Sales Representative,Success Korea,서울,,studies. · Manage contract negotiations. · Develop long- term strategic relationships with key accounts. · Ensure customer...
https://kr.indeed.com/viewjob?jk=65ff97c7ab1601fd,Finance Manager,Smiths Group,대한민국,,"recognition, project costing, billing plan monitoring for long term programme contracts . Lead timely submission of Forecast..."
https://kr.indeed.com/viewjob?jk=16a0035c04046619,KR_AH_CA Buse Head,Boehringer Ingelheim,대한민국,,"family owned company, we focus on long- term performance. We believe... we... ensure short & long term objectives..."
https://kr.indeed.com/viewjob?jk=1063028b68de35ae,Account Manager 1,DSM,경기도,,ensure the realization of planned business results and long- term customer relationships. Key Responsibilities Plan...
https://kr.indeed.com/viewjob?jk=d7e0bdeef4b7d137,HR & Admin Manager,Success Korea,서울 중구,,organizational effectiveness (translate long term strategic and short term operational challenges into people related plans...
https://kr.indeed.com/viewjob?jk=053c6c1495ac57bf,Assistant Brand Manager,Success Korea,서울,,annual and long term marketing objectives... targets over the short and long term - Development of plans- ABM is responsible...
https://kr.indeed.com/viewjob?jk=9aa85936e768fba9,Major Account Manager,SailPoint,대한민국,,forecasts; prioritize efforts; generate short term results while holding a long- term perspective to maximize overall...
https://kr.indeed.com/viewjob?jk=9406c6bd8ce2195b,"Advertising Solutions Architect, gTech Professional Services...",Google,서울,,customers attain... business goals while building long- term capabilities. Behind every advertising campaign at Google...
https://kr.indeed.com/viewjob?jk=11fe2fe9e67c67ca,Trainee Sales Associate (신세계 광주 아동),Burberry,광주광역시,,mindset is core to our business and key to our long- term success. JOB PURPOSE 개인 및 매장 판매 목표를 초과 달성하기 위해 노력하고 소매점 주도 성장의 주요...
https://kr.indeed.com/viewjob?jk=e98493b33e1f421a,"Marketing Director, Converse - Korea",Converse,서울,,seasonal go-to-market execution. * Own both the long- term and short- term brand strategies for Korea... center person...
https://kr.indeed.com/viewjob?jk=d9cb4b0a88e878ef,Livestream Operations Manager - South Korea,틱톡,서울 강남구,,"Talents for live-streaming section. 2. Build and maintain long- term relationship with MCN, agencies and influencers (KOLs). 3..."
https://kr.indeed.com/viewjob?jk=983cce8d1fef89b3,[Lionbridge] Korean Content Editor 경력,라이온브리지테크놀로지스코리아,서울 마포구,,need... living within commuting distance from Seoul. Long- term and regular commitment to our localization projects...
https://kr.indeed.com/viewjob?jk=84395780df590870,Laundry & Home Care Sales Graduate Development Program One Y...,Henkel,서울 강남구,,"JOB ID: 21027112 Contract & Job type: Full Time, Limited Term Contact information for application-related questions..."
https://kr.indeed.com/viewjob?jk=b30f5e07604b2c64,"Sales Manager, Korea","Frost and Sullivan, Inc.",서울 강남구,,"skills with an ability to initiate, acquire and build long term relationships with Senior Management; • Minimum 5 years..."
https://kr.indeed.com/viewjob?jk=baddba684cea31d7,Occupational Therapist,U.S. Army Medical Command,대한민국,,"Individual Education Plan (IEP... short and long- term achievement goals. Plan, coordinate, and manage all aspects of EDIS..."
https://kr.indeed.com/viewjob?jk=554a238d92de40ac,Reblozyl Marketing Manager (Hematology New Product Manager),Bristol Myers Squibb,서울,,actions mutual long- term benefits in our... term perspective and may trade off immediate costs... sake... long- term...
https://kr.indeed.com/viewjob?jk=258eca5e4f817ded,"Industry Manager, Tech, Mobility, Large Customer Sales",Google,서울,,"audiences. Responsibilities Build sustainable long- term relationships with clients, media, and creative agencies. Formulate..."
https://kr.indeed.com/viewjob?jk=f79e0ff720da7fa6,GreenLake Solution Architect,Hewlett Packard Enterprise,서울,,Management. Market Research and Analysis. Develop long- term account and marketing strategy. Identify and establish strategic...
https://kr.indeed.com/viewjob?jk=ea6446897ecbd92c,Accounting Manager,KidsLoop,서울,,Staggered hours + Remote working) Annual incentive + Long term incentive Various family event support Learning & Development...
https://kr.indeed.com/viewjob?jk=88f15dda9d955075,HR Operations Associate,Under Armour,서울,,working in a shared environment; completes daily and long- term tasks through effective prioritization and time management...
https://kr.indeed.com/viewjob?jk=95e8c839f57253c2,"Senior Solution Consultant, EAM",Hexagon PPM,서울,,consequences of new ideas or concepts and anticipates long term opportunities and requirements formulating plans to meet them...
https://kr.indeed.com/viewjob?jk=1be01e0237ee0ab5,Intern - Economic Affairs (171198),United Nations ESCAP,인천,,commission of any... acts. The term “sexual exploitation” means any actual... conditions. The term “sexual harassment...
https://kr.indeed.com/viewjob?jk=aec461f105d1cb32,"Sr. Containers Specialist, Korea",Amazon Web Services Korea LLC,서울,,day-to-day interactions that identify prospects for long- term business opportunities. You... single-threaded owner...
https://kr.indeed.com/viewjob?jk=712cc03afc6b05be,Territory Sales Account Executive,Adobe,서울,,enterprise term-based agreement programs... subscription services as well as term-based enterprise license agreement an...
https://kr.indeed.com/viewjob?jk=d1c8f23ea443cb4c,International Business Developer,HILTI,서울,,"authority, negotiation skills. -Long- Term Strategic Thinking: Capable of explaining... have a long- term bonding with our..."
https://kr.indeed.com/viewjob?jk=4adc21d9381b5a92,Product Specialist,Mammotome,서울,,Sets short- and long- term sales/channel strategies and policies. Establishes sales goals and objectives. Responsible...
https://kr.indeed.com/viewjob?jk=9f78749732ceba0a,"Senior Manager of Business Development, Korea",Amazon Web Services Korea LLC,서울,,immediate issues our clients are facing but also... long term business needs... result we’re looking for someone who...
https://kr.indeed.com/viewjob?jk=80b0176b45280e4a,"Solutions Architect Manager - AMAZON Web Services, Korea",Amazon Web Services Korea LLC,서울,,managers within your larger organization when discussing mid- term customer strategy and architectural best practices · We...
https://kr.indeed.com/viewjob?jk=d4011e3fef5fbcfd,Vice President (VP) Sales South Korea (f/m/d),CoachHub,서울,,Further ancillary insurances like life and short- & long term disability Paid CoachHub4Good days to give back A flexible...
https://kr.indeed.com/viewjob?jk=cc82cf75a783b87c,Senior Audience Development Executive,Cision,서울,,"driving our culture, sparking innovation and achieving long- term success. Cision is proud to have joined more than 600..."
https://kr.indeed.com/viewjob?jk=03b58466d264a0b3,LE AE (차장급),Success Korea,서울 강남구,,line knowledge. ? Ability to develop long- term strategic and executive level... develop long- term strategic and executive...
https://kr.indeed.com/viewjob?jk=9c96de00bfa2446d,"Manager, Sales Development",DataDog,서울,,continues to innovate... well positioned... long term... Team: Our sales team works... best-of-breed product...
https://kr.indeed.com/viewjob?jk=6dd43547448a7276,Assoc. Clinical Sales Specialist,Edwards Lifesciences,서울,,"meet sales targets while contributing to development of short- term region plan • Builds and manages strong, long-lasting..."
https://kr.indeed.com/viewjob?jk=53308ae6ce2b29ef,"Business Development Manager, Gaming - Amazon Web Services,...",Amazon Web Services Korea LLC,서울,,"Korea. You will identify short- term growth opportunities and lay the groundwork for long- term, strategic opportunities. Our..."
https://kr.indeed.com/viewjob?jk=fdbca48580f72145,KERING After Sales Specialist,KERING KOREA LTD,서울,,regardless... background. Job Type Fixed Term (Fixed Term) Start Date 2021-10-01 Schedule Full time Organization...
https://kr.indeed.com/viewjob?jk=14971f59416c49c0,Legal Counsel,AESOP Corporate,서울,,threats and opportunities. Implement and execute short to long term strategies to address such threats and opportunities...
https://kr.indeed.com/viewjob?jk=ec6726fd92f5f037,Mindshare | eCommerce Manager,Mindshare,서울,,Grow team’s strategic capabilities and develop sound long term strategic plans for all the key brands. What you will need...
https://kr.indeed.com/viewjob?jk=fb8f5764cdbe3c39,"Customer Solutions Engineer, Global Client and Agency Soluti...",Google,서울,,customers attain... business goals while building long- term capabilities... Global Client and Agency Solutions (GCAS...
https://kr.indeed.com/viewjob?jk=238a86dee317baaf,SEM Specialist,Asiance,서울,,품권 지급 Working from home Leaving work at 4 o'clock on Long- term employee Chuseok & every Wednesday (Flexible) the last Friday...
https://kr.indeed.com/viewjob?jk=0ab807ae683b66f8,"Agency Development Manager, Google Customer Solutions (Engli...",Google,서울,,"Manager, you'll focus on growing long- term relationships with managed traditional... data-driven long- term agency plans..."
https://kr.indeed.com/viewjob?jk=18622d099e1bc962,Technology Specialist _ Digital Native,Microsoft,서울,,customer pipeline Collaborate with customer to build a long- term cloud transformation vision Authorization to make major...
https://kr.indeed.com/viewjob?jk=3180cae5fd199f29,CYP Assistant Director,"US Commander, Navy Installations",대한민국,,"spouse & dependent life insurance, long- term disability, retirement, and 401(k... life insurance, long- term disability..."
https://kr.indeed.com/viewjob?jk=c41f04b7e9d8d171,Azure Specialist,Microsoft,서울,,influence long- term strategic direction... Articulates business value and long- term implications for customer business...
https://kr.indeed.com/viewjob?jk=52d519e249db6a13,Server Build Technician (Seoul),"SoftLayer Technologies, Inc.",서울,,who have 1 year of working experience or related educational qualifications are encouraged to apply Fixed Term Contract
https://kr.indeed.com/viewjob?jk=a0b307ed6e3af681,Advertising Account Director - Twitch,Twitch Korea LLC,서울 강남구,,"clients, agencies, and media reps. · Develop and manage long- term strategic relationships with clients and agencies. · Create..."
https://kr.indeed.com/viewjob?jk=1b3f1b09be89415d,Pricing Manager,HILTI,서울,,reach team and organizations. We are proud to have a long- term bonding with our employees: More than 30% of our employees...
https://kr.indeed.com/viewjob?jk=3ae73b094ebd696b,Junior Innovation Advisor,Mind the Bridge,대한민국,,"strong interpersonal skills and ability to create positive, long- term working relationships by demonstrating a commitment..."
https://kr.indeed.com/viewjob?jk=ed0e8106b826b676,Business Development Manager,SoftwareONE,서울,,"new business opportunities Effectively build and optimize long term, sustainable and profitable relationships with clients..."
https://kr.indeed.com/viewjob?jk=46be5e65f5f55cda,CIB Operations - Client Onboarding Middle Office - KYC Speci...,"JPMorgan Chase Bank, N.A.",서울,,"drives everything we do. We strive to build trusted, long- term partnerships to help our clients achieve... business..."
https://kr.indeed.com/viewjob?jk=13bb2a91b412094c,Account Manager II,Eastman,서울,,market segment in Korea Achieve short term annual sales target and meet mid/long term milestones of growth projects. Build...
https://kr.indeed.com/viewjob?jk=d0ad8f71796bc1ff,DTS Client Executive - SK Group,Dell Technologies,서울,,"large-scale, high value growth opportunities... long- term perspective. Develop ‘game-changing’ business models..."
https://kr.indeed.com/viewjob?jk=892ac59317a23cbb,[Richemont Group] C&B Manager,Richemont,서울,,"analysis... gender pay gap analysis, etc. • Short- term and Long- term incentives management Benefit Management • Lead..."
https://kr.indeed.com/viewjob?jk=2c1b67a53e5502d0,"Senior Specialist Talent Acquisition Seoul, South Korea Peop...",Philip Morris International,서울,,talent for both the short and long term requirements... organization. Lead... sharing and long- term talent pool...
https://kr.indeed.com/viewjob?jk=0f172ffa77824a14,"Specialist, Relationship Management - Asset Servicing",BNY Mellon,서울,,"client, advising... best way to achieve short- and long- term strategic objectives. From a global, bank-wide perspective..."
https://kr.indeed.com/viewjob?jk=e76a60c6b12e7633,"Executive Assistant/ Business Administrator, Macquarie Capit...",Macquarie Group Limited,서울,,one year fixed term contract. About... Job no: MacCap-962042 Work type: Fixed term Location: Seoul Category: Junior...
https://kr.indeed.com/viewjob?jk=e666f81b17b8fd40,"Technology Operations Analyst, Seoul","JPMorgan Chase Bank, N.A.",서울,,"drives everything we do. We strive to build trusted, long- term partnerships to help our clients achieve... business..."
https://kr.indeed.com/viewjob?jk=562387769f0694ec,"Territory Manager, South Korea",Zoll Medical Corporation,서울,,assigned. Responsible for maintaining short range and long term plans for developing sales within the assigned territory...
https://kr.indeed.com/viewjob?jk=c93220a010f0f25d,Systems / Network Administrator - OCONUS,CACI,대한민국,,Start: TS/SCI with Polygraph Employee Type: Regular-Long Term Assignment Percentage of Travel Required: Up to 10% Type...
https://kr.indeed.com/viewjob?jk=12657280ba0e5255,Commercial and BD Lead (APAC),Chronos Consulting,서울,,VC world’s biggest names... startup is poised for long- term global success. The BD and Commercial Lead for APAC...
https://kr.indeed.com/viewjob?jk=9ceb11d58506da7f,Account Manager - Seoul,Booking.Com,서울,,exciting developments that lie ahead... strategic long- term investments into what we believe the future of travel can...
https://kr.indeed.com/viewjob?jk=0049e64a61fecda5,IMC- PR Mgr,Success Korea,서울 강남구,,자격요건 담당직무 1.Draft and develop competitive short & long term digital strategy 2. Improve digital media spending effectiveness...
https://kr.indeed.com/viewjob?jk=e1736eedb55c4b94,[Janssen] Marketing Manager - Dermatology,Johnson & Johnson Family of Companies,서울,,competitor landscape translate them into clear short term and long- term strategies - Self-driven with proven track record...
https://kr.indeed.com/viewjob?jk=3e3844a591e7557c,Sourcing Recruiter,Amazon Web Services Korea LLC,서울,,"pay only for what they use... up-front expenses or long- term commitments, making AWS the most cost-effective, flexible..."
https://kr.indeed.com/viewjob?jk=534ced84e37f7080,Marketing specialist,Emerson,경기도,,Manager and Sales Team to make the most appropriate short term and long term strategic directions and actions by providing...
https://kr.indeed.com/viewjob?jk=d1aabd8c2dd33f32,Head of Asset Development & Consultancy Korea / PDS 자산 개발 및...,JLL,서울,,strong client network within the industry as part of a long- term vision for sustainable and growing revenues. Capable...
https://kr.indeed.com/viewjob?jk=4bfe5e82fe49587e,"Enterprise Sales Executive (Retail, Food & Beverages and Tra...",UiPath,서울,,execute account strategy and road maps... long term relationship Develop and maintain relationships with decision makers...
