Link,Title,Name,Location,Salary,Summary
https://kr.indeed.com/viewjob?jk=f97a9dc7fec20c8d,Account manager,OSIsoft,서울,,willing to learn Motivated by results and ultimately long- term customer satisfaction Ability to travel to customer sites...
https://kr.indeed.com/viewjob?jk=0f7d5d66836a6766,"SEAK Business Solution Operations , Seoul",VMware,서울,,Account team to build pipeline for both long term and short- term closure Produce and present customer financial business...
https://kr.indeed.com/viewjob?jk=cd4bbc45d2af8525,Medical Health Services Department Manager,TÜV SÜD,서울,,"market/industry, competitor and customer information - Setup long term business objectives and formulate business strategies..."
https://kr.indeed.com/viewjob?jk=310505223471e6c9,"Senior Application Architect, Global Specialty Practice, Pro...",Amzn Corporate Services Korea,서울,,have a demonstrated ability to think strategically and long- term about the needs of global businesses... deeply familiar...
https://kr.indeed.com/viewjob?jk=c36861edde8ef58b,"Sr. Professional, Account Management",Under Armour,서울,,"development... Partner’s seasonal, annual and long- term plans based on an understanding... Partner’s consumer base..."
https://kr.indeed.com/viewjob?jk=c3c8d9f750cc10e6,"Sr. Director, Head of Risk – Korea & Mongolia",Visa,서울,,"stakeholders so... advance the safety, security and long- term growth... Visa payment system. Key Relationships..."
https://kr.indeed.com/viewjob?jk=199a82723bbbd42f,Professional Div. - Product Manager,Shiseido International France,서울,,sales report & analyze keyline sales. Set up Short / long term strategies by supporting marketing manager Manage all aspects...
https://kr.indeed.com/viewjob?jk=15eda1556c270fb0,CADD팀 (팀장) - IT신기술 기반 신약개발 신약개발 전문기업,,경기도,,"제공 2) GPCR, non-GPCR pipeline 매니저 cross communication 3) Long Term Project : ( 협의 후 결정 ) 4) 교육 훈련 참가 : ( 협의 후 결정 ) 5) 기타 Role..."
https://kr.indeed.com/viewjob?jk=8e5840177aa7af82,Corporate & Investment Bank_Credit Risk Associate,"JPMorgan Chase Bank, N.A.",서울,,"familiarity with term sheets / loan... do. We strive to build trusted, long- term partnerships to help our clients achieve..."
https://kr.indeed.com/viewjob?jk=6a3b42004d50460c,Site Engineer - OCONUS - TS/SCI Poly,CACI,대한민국,,Start: TS/SCI with Polygraph Employee Type: Regular-Long Term Assignment Percentage of Travel Required: Up to 10% Type...
https://kr.indeed.com/viewjob?jk=655248dadf1509ed,"Senior. Program Manager, Data Center Planning and Delivery",Amzn Corporate Services Korea,서울,,resources... lose sight of long term goals. In order... successful... impact... long- term success of AWS...
https://kr.indeed.com/viewjob?jk=aff1b658cc6c0851,DISW - Solution Architect,Siemens Industry Software Ltd.,서울,,complexity of solution architecture options... long term roadmap... solution. Act... ultimate authority...
https://kr.indeed.com/viewjob?jk=d117e6f60ea413de,Actuary (DFA),Largest Korean Life & Fire Ins,대한민국,,"entities in used efficiently - Term of Employment Position: Manager (2year Contract Term, Renewable) - Position is located..."
https://kr.indeed.com/viewjob?jk=da0954427ebd22e4,Business Sales & Delivery Executive - Associate Partner,Kyndryl,서울,,book of accounts... expected to establish trusted long- term relationships with those clients through... ability...
https://kr.indeed.com/viewjob?jk=57b59ec057891dbe,Payroll Administrator - remote,Iron Mountain,대한민국,,creates exceptional. Payroll Administrator - Fixed- term (until 31st of March 2022) Payroll Administrator is responsible...
https://kr.indeed.com/viewjob?jk=c6a97b09ed819f52,NGSA Sales Enablement Lead,Dell Technologies,서울,,relevant experience... industry • Experience with short term and long term strategic planning • Experience working cross...
https://kr.indeed.com/viewjob?jk=28424fee09a90c2d,Account Mgr,Risk Solutions,대한민국,,"responsible for sales results. • Establishes strong, long- term customer relationships and cultivates new business..."
https://kr.indeed.com/viewjob?jk=cf7e073df1c29fce,"Account Manager, Intermed",Keysight Technologies,대구,,maintaining... satisfaction. Maintains positive ongoing long- term relationships with key customers. Interprets customer...
https://kr.indeed.com/viewjob?jk=1c74d5980f6a985a,HR Business Partner,Thermo Fisher Scientific,서울,,opportunities and challenges to meet long and short- term strategic objectives. The focus area... role... support...
https://kr.indeed.com/viewjob?jk=8760aee511eafe36,외국계 IT 기업 - AE,Success Korea,서울 강남구,,line knowledge. - Ability to develop long- term strategic and executive level... develop long- term strategic and executive...
https://kr.indeed.com/viewjob?jk=501cb03bcb2f94ff,KR_HP_Market Access Manager (Temp.),Boehringer Ingelheim,대한민국,,"family-owned ever since, Boehringer Ingelheim takes a long- term perspective. Now, we are powered by 52,000 employees globally..."
https://kr.indeed.com/viewjob?jk=23ef68a78c7d4e0d,Key Account Manager,Accolade Wines,대한민국,,encourages long term business growth... outcomes. * Monitor and manage trading term compliance. * Other responsibilities...
https://kr.indeed.com/viewjob?jk=890e2da4690f09e9,Telecommunications Engineering Specialist,Barbaricum,경기도 평택,,"objectives... clearly defined near- term, mid- term, and long- term initiatives. Qualifications Active DoD Secret..."
https://kr.indeed.com/viewjob?jk=9809eca73e3085a0,Alliance Leader [상무],Kyndryl,서울,,seek opportunities for mutual long term growth Understand our client’s strategic... near and long- term business improvement...
https://kr.indeed.com/viewjob?jk=51b01ccc49d7488e,Theme Park Business Developer,Theme Park N Attractions,경기도 용인,,"multi-national amusement/theme park companies Contract Term: 2yrs, but renewable. Compensation: Very competitive (Negotiable..."
https://kr.indeed.com/viewjob?jk=1b5de8bf531725b7,Account Manager I - F&B,Ecolab,서울,,"set of cleaning and sanitation solutions Carve out a long term, advanced career path in sales/service, corporate accounts..."
https://kr.indeed.com/viewjob?jk=ae859dd1db4fc46c,General Manager Korea,DSM,경기도,,Responsible for customer management. Establish long term relationship with strategic accounts and relevant stakeholders...
https://kr.indeed.com/viewjob?jk=5cac2744e381ee05,Commercial Excellence (CE) Team Manager,Novo Nordisk,서울,,"deployment, target setting, operational call planning and short term incentive design). Manage the development and effective..."
https://kr.indeed.com/viewjob?jk=eeee68d268934495,PM(Project Management),Success Korea,대한민국,,Job Development & Utilization Short- Term Plan (2~3 years) - SAIT102 Programme... Utilization Short- Term Plan (2~3 years...
https://kr.indeed.com/viewjob?jk=d426600f02cfcedb,"Associate Director, Marketing Effectiveness",Nielsen,서울,,references and analyst data. Generating short- term results whilst maintaining a long- term perspective to maximize overall...
https://kr.indeed.com/viewjob?jk=e23867afee0da3f9,[Janssen] Product Manager - Solid Tumor,Johnson & Johnson Family of Companies,서울,,competitor landscape translate them into clear short term and long- term strategies. - Self-driven with proven track record...
https://kr.indeed.com/viewjob?jk=6c64984fc8c15153,Talent Sourcer,Dell Technologies,서울,,Korea and South Asia. You will implement short- and long- term strategies to ensure... talent search targets are met...
https://kr.indeed.com/viewjob?jk=d5fc990853b19292,"[존슨앤드존슨] Head of Medical Devices HR & One HR, North Asia (Di...",Johnson & Johnson Family of Companies,서울,,short- and long term needs to achieve... strategies that meet long- and short- term goals - Talent mindset: develop high...
https://kr.indeed.com/viewjob?jk=96923962a251cb9c,"Sales Account Manager, Senior",BorgWarner,서울,,executes various Sales tasks including: Annual & long- term revenue target Finance improvement including cost reimbursement...
https://kr.indeed.com/viewjob?jk=57800adec3e15160,[원익홀딩스] 대졸공채,원익그룹,성남 삼평동,,"기술력 확보, 고객 기술 Issue 사항 해결 방안 제시] 1. 장비 개선 및 검증 Test - Short Term 장비 개발 및 System 기능 개선 - 신규 Parts 개발 및 검증 Test 2. 기술 검토 및 지원..."
https://kr.indeed.com/viewjob?jk=00a259b1ddbf5788,"E-Commerce Opportunities 매니저, 팀장 채용",Success Korea,서울 청담동,,business plans that result... establishment of a long term interactive... consumer - Develop a plan and Lead global...
https://kr.indeed.com/viewjob?jk=8ed386ece27e60d5,"Financial Planning&Analysis, Associate",Otis,서울,,"gu, Seoul, Korea Key Responsibilities: • Develop long term business plan, yearly business plan and 3months rolling forecast..."
https://kr.indeed.com/viewjob?jk=2c4859dcecf5d674,Business Development Manager - Gaming,TikTok,서울,,"organizations and influencer groups, working to drive long- term adoption and set growth strategies for our partners. Ideal..."
https://kr.indeed.com/viewjob?jk=6b03161b6193d830,Jr.Analyst,Ralph Lauren,서울 강남구,,Long Range Plan to achieve company strategic goal in long term view · Frequent and continuous communication with business...
https://kr.indeed.com/viewjob?jk=9e6f35f3bd13e57b,KERING Legal Assistant (Fixed-Term),KERING KOREA LTD,서울,,Assistant (1yr Fixed- Term) Division... background. Job Type Fixed Term (Fixed Term) Start Date 2021-12-15 Schedule...
https://kr.indeed.com/viewjob?jk=0e0b2303bed65668,L.E.A.D in Maersk Korea,Maersk,서울,,together with others. • Strong desire to pursue a long- term career in transport and logistics. • You... an excellent...
https://kr.indeed.com/viewjob?jk=a9b90a7d08e03905,"Manager, Studio Strategy & Analysis",Netflix,서울,,"making and timely execution Develop country-level long- term studio strategies, facilities, and resource plans and support..."
https://kr.indeed.com/viewjob?jk=5ae63a96736e5b91,Intern (February - August 2022),Macquarie Group Limited,서울,,"principal investment. Job no: INT-962078 Work type: Fixed term Location: Seoul Category: Junior, Asset Management, Graduate..."
https://kr.indeed.com/viewjob?jk=b564819422c98392,E-commerce intern,H&M,서울 종로구,,"group – short and long term. Responsible... customer satisfaction, short and long- term. Daily optimization and evaluation..."
https://kr.indeed.com/viewjob?jk=5b7b34fa0d818cb2,Associate PSR,Organon,서울,,calls or emails. Employee Status: Temporary (Fixed Term) Relocation: Domestic VISA Sponsorship: Travel Requirements...
https://kr.indeed.com/viewjob?jk=983933b8a40c1813,Assistant Store Manager (롯데 본점 남성),Burberry,서울,,mindset is core to our business and key to our long- term success. JOB PURPOSE Through your passion for your product area...
https://kr.indeed.com/viewjob?jk=da1c20427b2764df,Intern (March,Macquarie Group Limited,서울,,"principal investment. Job no: INT-961927 Work type: Fixed term Location: Seoul Category: Junior, Asset Management, Graduate..."
https://kr.indeed.com/viewjob?jk=00fbbe5760a7d330,E-commerce intern (6 months contract),H&M,서울 종로구,,"group – short and long term. Responsible... customer satisfaction, short and long- term. Daily optimization and evaluation..."
https://kr.indeed.com/viewjob?jk=24a5fd77293f412a,Korea Stat & Tax Controller,Microsoft,서울,,workload perspective. Build trust to lay the foundation of long- term growth from a customer and shareholder point of view...
https://kr.indeed.com/viewjob?jk=438adba5847882f6,"Offcycle internship, Macquarie Capital Korea",Macquarie Group Limited,서울,,"principal investment. Job no: MacCap-962251 Work type: Fixed term Location: Seoul Category: Junior, Corporate Finance / M..."
https://kr.indeed.com/viewjob?jk=fe88308384f55644,M&A Specialist - Generalist,뤼이드,서울 강남구,,"RiiidCollaborate with internal teams to assist in long- term financial planning, assessment of financial results, and creation..."
https://kr.indeed.com/viewjob?jk=66b3fa7e0c4e3e2d,Sr Staff FAE,Renesas Electronics Corporation,서울 강남구,,opp - Business strategy for mid/long- term biz expansion - Understanding FAE role... strategy for mid/long- term biz expansion...
https://kr.indeed.com/viewjob?jk=a34e2184cddacfd7,Head of Digital (New position),국경없는의사회 한국,서울 강남구,,"meeting our global objectives, • Define the midterm/long term vision and strategy for MSF’s fundraising, communication, HR..."
https://kr.indeed.com/viewjob?jk=6ebd41f7c269b5bb,A&T Office - Occupier 사원급 (Entry-level),CBRE,서울,,"materials necessary for transactions - Prepares offers, term sheets and lease amendments... responsible for project..."
https://kr.indeed.com/viewjob?jk=efab6d4feed3e772,Marketing Specialist (수시모집 인재풀 등록),3M,서울,,analytical skills to analyze trends or marketing data. Uses short- term planning skills when forecasting or providing guidance...
https://kr.indeed.com/viewjob?jk=2bcc127fa59fa238,"Account Manager, Samsung - Amazon Web Services, Korea",Amazon Web Services Korea LLC,서울,,Manage and support customer interactions · Develop long- term strategic relationships with key accounts. · Ensure customer...
https://kr.indeed.com/viewjob?jk=bc6160ceec3a49f7,Knowledge Analyst - Panorama Financial Institutions Insights...,McKinsey & Company,서울,,within your area of expertise as well as provide short- term support for delivering key insights on content-focused questions...
https://kr.indeed.com/viewjob?jk=bcc6fd8422c3b005,"Manager, Marketing Strategy",Netflix,서울,,"paid, digital, social, partnerships etc.) Evaluate short and long term performance of marketing activities Drive operational..."
https://kr.indeed.com/viewjob?jk=f89ee17456fc7153,"Asset Management, Assistant, Seoul",Goldman Sachs,서울,,around the world... dedicated partnership and focus on long- term performance. As primary investment area within Goldman...
https://kr.indeed.com/viewjob?jk=23a99fa8b1a54363,Client Executive,Microsoft,서울,,establish strong alignment on long- term goals and secure buy... execution... creation of long- term strategies aimed...
https://kr.indeed.com/viewjob?jk=b22295422e62a558,"Director, Production Management",Netflix,서울,,areas as early as possible Negotiate facility deals for long- term stage rentals Identify and hire producer / line producers...
https://kr.indeed.com/viewjob?jk=ca01112f2d124b7e,E-Boutique Professional,Chanel,서울,,platform & identify new opportunities - building strong & long term partnerships with operators to get analytics and customer...
https://kr.indeed.com/viewjob?jk=fd624aa400347c5d,Livestream Operations Manager - South Korea,TikTok,서울,,"Talents for live-streaming section. 2. Build and maintain long- term relationship with MCN, agencies and influencers (KOLs). 3..."
https://kr.indeed.com/viewjob?jk=4129ae7fb452bdd8,PES Presales Internship,Siemens,서울,,"academic or career goals. Internships are generally one term experiences, generally... summer, though some can translate..."
https://kr.indeed.com/viewjob?jk=e745d37ace6b4470,Customer Success Analyst - Korea (6 Months Fixed-Term),MOLOCO,서울 강남구,,6-Months Fixed- Term Customer Success... approach... focus on building long- term partnerships. Passions for continuous...
https://kr.indeed.com/viewjob?jk=caae60559135ce1c,Cross Border Ecommerce - Project Management,Shopee,서울,,projects Lead some issue management and develop short term and long term solution Efficiently organise and convene meetings...
https://kr.indeed.com/viewjob?jk=02f7728ea7f5727e,Talent Acquisition Manager,Burberry,서울,,stakeholders and team members Ability to see short term and long term effects of possible actions Commercial and retail mind...
https://kr.indeed.com/viewjob?jk=24e1701d657edb00,Programme Officer,United Nations,인천,,commission of any... acts. The term “sexual exploitation” means any actual... conditions. The term “sexual harassment...
https://kr.indeed.com/viewjob?jk=a1d898b754a5f9d4,"Manager, Risk & Intelligence",Netflix,서울,,variety of genres and languages. Visit our culture memo and long- term view to learn more about the unique Netflix culture...
https://kr.indeed.com/viewjob?jk=c85169cf4c060326,[Janssen] PV Specialist,Johnson & Johnson Family of Companies,서울,,PV specialist 2. 계열사: 한국얀센 (Janssen) 3. 근무지: 서울시 용산구 4. 근무 형태: Fixed Term [Responsibilities] - Fulfill the responsibility...
https://kr.indeed.com/viewjob?jk=2e8a023bed940918,Trainee Sales Associate 2 (신세계 본점 남성),Burberry,서울,,mindset is core to our business and key to our long- term success. JOB PURPOSE 개인 및 매장 판매 목표를 초과 달성하기 위해 노력하고 소매점 주도 성장의 주요...
https://kr.indeed.com/viewjob?jk=1a9c0a18e7fe14f6,Marketing Communication,Beckman Coulter Diagnostics,서울,,Plan marketing events including budget and short and long- term strategy Create and maintain consistent corporate brand/image...
https://kr.indeed.com/viewjob?jk=90488f7ddfe1049b,"Commercial Operation Manager, Korea and Taiwan",머크,서울 강남구,,establishment of training priorities for both long term and short- term objectives Monitors and reports on progress...
https://kr.indeed.com/viewjob?jk=dfba483e59693f1e,"컨텐츠제작, 번역 외 신입/경력 정규직",킹스라이프스타일,성남 수정구,,LOOKING FOR LONG TERM PEOPLE (1-2 YEARS... media content design-Can commit to long term (2+ years)*Marketing Strategist...
https://kr.indeed.com/viewjob?jk=35e4a1f3c6ad0b5c,Assistant Project Manager ( Fixed Term Contract ),GE Gas Power,경기도 성남,,Job Description Summary Job Description Responsibilities Own the Customer relationship to understand... perspective...
https://kr.indeed.com/viewjob?jk=41f0bf1d8fb8d2f6,Cross Border Ecommerce - Project Management (Based in Seoul),Shopee,서울,,projects Lead some issue management and develop short term and long term solution Efficiently organize and convene meetings...
https://kr.indeed.com/viewjob?jk=ac55c2f91d46f0df,KR HP Associate Medical Affairs Lead (Jardiance),한국베링거인겔하임,서울 중구,,"family-owned ever since, Boehringer Ingelheim takes a long- term perspective.Now, we are powered by 52,000 employees globally..."
https://kr.indeed.com/viewjob?jk=e95c7a43409e805b,Customer Support (Chat) - Korean/English - Music Streaming,ModSquad,서울,,enjoyable online environment... an established and long- term project with an incredibly strong internal support system...
https://kr.indeed.com/viewjob?jk=335d465aeda39c94,ESL Teacher,Teach Away,대한민국,,class on average) All contracts... minimum one year term E2 sponsorship if required Full quarantine support during...
https://kr.indeed.com/viewjob?jk=a07c1ac31bb7090e,HR Assistant,RWS,서울,,experience of using HRIS systems; Understanding of payroll processes Category Human Resources Job Type Fixed Term Contract
https://kr.indeed.com/viewjob?jk=a825d432af879511,Consultant - Capital Productivity,McKinsey & Company,서울,,continuous improvement effort or developing short and long- term capability-building plans for all relevant levels of client...
https://kr.indeed.com/viewjob?jk=9bc3561c9fe47911,Senior Retail Manager,Burberry,서울,,mindset is core to our business and key to our long- term success. JOB PURPOSE RESPONSIBILITIES PERSONAL PROFILE
https://kr.indeed.com/viewjob?jk=3a08b30ab659e141,Business Developer - Career,Eastman,서울,,"Optimistically focus on continual growth over a longer- term horizon • Bias for Action: Have a bias for action, prioritizing..."
https://kr.indeed.com/viewjob?jk=44f4f9ebdf9a0273,Head of OFF Premise (Seoul) with Distribution Partner,Red Bull,서울,,"Premise vision, long term plan, annual... Partnerships that generate long term value for Red Bull, Customers and Consumers..."
https://kr.indeed.com/viewjob?jk=32627c734b57ab54,Cybersecurity Consultant,DNV,서울,,"support our customers to transition and realize... long- term strategic goals sustainably, and collectively contributing..."
https://kr.indeed.com/viewjob?jk=7f728e5d2b6df57c,Strategic Finance & IR Associate,뤼이드,서울 강남구,,"board presentations, maintenance of corporate short- term and long- term financial modelDevelop a deep understanding..."
https://kr.indeed.com/viewjob?jk=ecee1fd4053adfca,MACH Regional Product Manager,KLA,경기도 화성,,"market share, and penetration. Account for near and short term business requirements, competition, and total team capability..."
https://kr.indeed.com/viewjob?jk=7214bbcb8d129eb8,Sr Certification Engineer,Honeywell,서울,,"South Asia, Russia, India, Europe, Australia) Build long- term relationship with certification bodies (e.g. UL, CSA, Intertek..."
https://kr.indeed.com/viewjob?jk=1cef5afbf6396602,Back-end Developer/DevOps Engineer,Asiance,서울,,품권 지급 Working from home Leaving work at 4 o'clock on Long- term employee Chuseok & every Wednesday (Flexible) the last Friday...
https://kr.indeed.com/viewjob?jk=31d35842108c401b,Customer Success Manager,Aspen Technology,서울,,Responsible for nurturing assigned account base into long term strategic partnerships while increasing customer usage...
https://kr.indeed.com/viewjob?jk=eab9b79ffddcf137,Manager Sales,Hasbro,대한민국,,Demonstrated ability to develop and drive clear short to mid- term omni channel strategy to maximize physical availability...
https://kr.indeed.com/viewjob?jk=c584e6373cfe8d42,Principal Field Service Specialist,Raytheon Intelligence & Space,대한민국,,"fill a long- term position... Global... test. Interface with customers on short- term and long- term technical, operational..."
https://kr.indeed.com/viewjob?jk=8669483b11225a91,Renewables Consultant - Civil / Structure Engineering,DNV,서울,,comprises the delivery of Measurement Services and long- term energy forecasts to support due diligence of wind and solar...
https://kr.indeed.com/viewjob?jk=ab15e004221d1c15,"Enterprise Service Manager, Professional Services Korea",Amazon Web Services Korea LLC,서울,,"large organizations, develop a long term Professional Services strategy and execute... Supporting long term development of large..."
https://kr.indeed.com/viewjob?jk=cc100aca060767e8,E-retailer&CRM manager,Success Korea,서울 강남구,,"execution of new recruitment promotion with long- term and short- term program 4/ DM, MMS: customer data segment (Campaign Set..."
https://kr.indeed.com/viewjob?jk=7ce637c32b62b162,ISR - 외국계 IT 솔루션 밴더사,Success Korea,서울 강남구,,skills. 8. Ability to develop long- term strategic and executive level relationships... develop long- term strategic and executive...
https://kr.indeed.com/viewjob?jk=23851dd9b9cce3be,Account Partner/어카운트 파트너,Salesforce,서울,,approach that positions Salesforce and yourself as a long- term trusted advisor relationship ・Create a compelling vision...
https://kr.indeed.com/viewjob?jk=b8f440289f51dc9d,TikTok Live Operations Leader,ByteDance,서울,,live streaming team for South Korea; - Making short term and long term strategy and plans for live streaming development...
https://kr.indeed.com/viewjob?jk=075abc31f2654d16,Product Marketing Manager (SDA),Success Korea,대한민국,,Secure mid/long term product portfolio... thorough execution. Secure mid/long term product portfolio to fulfill local...
https://kr.indeed.com/viewjob?jk=fa63672e41acad0e,Business Consultant (Area focus: CRC/ECOM) - Temporary Posit...,Richemont,서울,,"CRC/ECOM) - Temporary Position Richemont Seoul, 11, KR Fixed Term Richemont owns some... world’s leading luxury goods..."
https://kr.indeed.com/viewjob?jk=eecbde14edf0a285,Technical Account Manager in Automotive Industry,MathWorks,서울,,customer’s workflow Develop and maintain long- term End User Relationships by providing excellent technical/customer service...
https://kr.indeed.com/viewjob?jk=2a809f8ef919aec1,Corporate Business Development & Strategy,Success Korea,서울 서초동,,joint ventures... 3) assisting... development of long- term strategy for RNTS divisions which include mobile platforms...
https://kr.indeed.com/viewjob?jk=890f9c60c6a3a41a,Sales Manager,Success Korea,서울 여의도역,,account... malls of product order. D. Build strong and long- term relationship... line malls especially social...
https://kr.indeed.com/viewjob?jk=c29db90fbc0229c3,"Seeking Competitive Bilingual(Gyopo) Teachers (Bucheon, Seou...",Francis Parker Collegiate,경기도 부천,,"school. If you are creative and consider teaching as your long- term career, please come to our school and join this thriving..."
https://kr.indeed.com/viewjob?jk=2ad7c0de795d8d24,"Account Manager, Google Marketing Platform (English, Korean)",Google,서울,,key relationships with customers. You... key partner for long- term growth planning to ensure the business continues...
https://kr.indeed.com/viewjob?jk=c895ed610aa7cfd3,Account Executive (APAC),Echobox,서울,,your region. You... charge of building long- term partnerships with key decision makers at large publishing companies...
https://kr.indeed.com/viewjob?jk=f4e6aee9dc2759d0,"Engr, Sales",Molex,경기도 안산,,drive value creation for profitable business growth upon long term base. The candidate must have the ability to work well...
https://kr.indeed.com/viewjob?jk=fde64e6948e8cdfa,PM-oncology,Success Korea,서울,,"brands marketing issues... achievement of short and long term business objectives, increased profit, and market control..."
https://kr.indeed.com/viewjob?jk=cf1f60fafb85966b,Management Controller,Valeo,대구,,gaps and variations with Budget 3. Participation... Middle Term Plan and Budget... entity 4. Support the Regional...
